{
  "assessments": [
    {
      "evidence": [
        "urn:example:evidence:regression-run"
      ],
      "id": "urn:example:assessment:regression",
      "method": "Exact-match evaluation over the versioned regression dataset.",
      "name": "Synthetic support regression",
      "observedAt": "2026-09-01T00:00:00Z",
      "result": "pass",
      "sensitivity": "public",
      "subject": "urn:example:agent:support",
      "validUntil": "2026-10-01T00:00:00Z"
    }
  ],
  "components": [
    {
      "evidence": [],
      "id": "urn:example:agent:support",
      "name": "Support agent",
      "origin": "declared",
      "sensitivity": "public",
      "type": "agent",
      "version": "1.0.0"
    },
    {
      "evidence": [],
      "hashes": [
        {
          "algorithm": "SHA-256",
          "value": "569e244dd3d21dda05cbcd88a27be2e3a3d41f428c9c7a00f0c2a20a77d54ab5"
        }
      ],
      "id": "urn:example:dataset:regression",
      "licences": [],
      "locations": [
        {
          "path": "data/evaluation/regression.jsonl"
        }
      ],
      "name": "regression.jsonl",
      "origin": "merged",
      "properties": {
        "artifactPath": "data/evaluation/regression.jsonl",
        "fileSize": 78,
        "usageAssertion": "repository-presence"
      },
      "sensitivity": "public",
      "type": "evaluation-dataset"
    },
    {
      "evidence": [],
      "hashes": [],
      "id": "urn:example:model:openai:gpt-4.1",
      "licences": [],
      "locations": [
        {
          "lineEnd": 4,
          "lineStart": 4,
          "path": "src/agent.ts"
        }
      ],
      "name": "gpt-4.1",
      "origin": "merged",
      "properties": {
        "provider": "openai",
        "usageAssertion": "source-reference"
      },
      "sensitivity": "public",
      "supplier": "OpenAI",
      "type": "hosted-model"
    },
    {
      "evidence": [],
      "hashes": [
        {
          "algorithm": "SHA-256",
          "value": "b7e4497416a7b3ae539b56348e0610ba1a7faddb40457598a5ad60ca887a9acf"
        }
      ],
      "id": "urn:example:prompt:support-system",
      "licences": [],
      "locations": [
        {
          "path": "prompts/system.prompt.txt"
        }
      ],
      "name": "system.prompt.txt",
      "origin": "merged",
      "properties": {
        "artifactPath": "prompts/system.prompt.txt",
        "fileSize": 98,
        "usageAssertion": "repository-presence"
      },
      "sensitivity": "public",
      "type": "prompt"
    }
  ],
  "context": {
    "repository": "example/support-assistant"
  },
  "document": {
    "contentDigest": {
      "algorithm": "SHA-256",
      "value": "de93ddbc51e783ceb37ef061a61d1f9cd37f1846f7ac7eeb79e4ff7e30c4a78b"
    },
    "generatedAt": "2026-09-08T22:49:31.000Z",
    "generator": {
      "name": "operational-aibom",
      "version": "0.1.0"
    },
    "id": "urn:aibom:document:sha256:de93ddbc51e783ceb37ef061a61d1f9cd37f1846f7ac7eeb79e4ff7e30c4a78b",
    "source": {
      "manifestPresent": true
    }
  },
  "evidence": [
    {
      "claim": "The supplier documents this identifier as a hosted model.",
      "class": "supplier-declaration",
      "id": "urn:example:evidence:model-card",
      "issuer": "OpenAI",
      "observedAt": "2026-09-01T00:00:00Z",
      "sensitivity": "public",
      "source": {
        "type": "uri",
        "uri": "https://platform.openai.com/docs/models"
      },
      "subject": "urn:example:model:openai:gpt-4.1",
      "validUntil": "2026-12-01T00:00:00Z"
    },
    {
      "claim": "The declared agent composition passed the synthetic regression suite.",
      "class": "organisational-assessment",
      "id": "urn:example:evidence:regression-run",
      "issuer": "Example platform team",
      "method": "npm-test-fixture",
      "observedAt": "2026-09-01T00:00:00Z",
      "owner": "Example platform team",
      "sensitivity": "public",
      "subject": "urn:example:agent:support",
      "validUntil": "2026-10-01T00:00:00Z"
    }
  ],
  "observations": [],
  "relationships": [
    {
      "evidence": [],
      "from": "urn:example:agent:support",
      "id": "urn:aibom:relationship:sha256:71c2906f82cd13a3bd63f05ea523683a1c6b1c4ba8294147dbce67fe35d671b5",
      "sensitivity": "public",
      "to": "urn:example:prompt:support-system",
      "type": "governed-by"
    },
    {
      "evidence": [],
      "from": "urn:example:agent:support",
      "id": "urn:aibom:relationship:sha256:80d729cfc59d4b01577fee4c73bd9095a40f0805ff710dd2f9e07df678ed633c",
      "sensitivity": "public",
      "to": "urn:example:dataset:regression",
      "type": "evaluated-with"
    },
    {
      "evidence": [],
      "from": "urn:example:agent:support",
      "id": "urn:aibom:relationship:sha256:9f6b9ee730324aacc9e2e92b3a1be392cd365d8484f39348955505135dfa6007",
      "sensitivity": "public",
      "to": "urn:example:model:openai:gpt-4.1",
      "type": "uses-model"
    },
    {
      "evidence": [],
      "from": "urn:example:system:support-assistant",
      "id": "urn:aibom:relationship:sha256:b28fe999e5a9a11b54d0d31fb262d1d7509e06992729547f22190ebd52bd4974",
      "sensitivity": "public",
      "to": "urn:example:agent:support",
      "type": "contains"
    }
  ],
  "schemaVersion": "0.1.0",
  "system": {
    "description": "Synthetic RAG assistant used to demonstrate operational AIBOM generation.",
    "id": "urn:example:system:support-assistant",
    "intendedUse": "Answer questions from approved support documents and create a support case after user confirmation.",
    "name": "Example support assistant",
    "owner": "Example platform team",
    "properties": {
      "criticality": "medium"
    },
    "sensitivity": "public",
    "version": "1.0.0"
  },
  "unknowns": [
    {
      "class": "explicit-unknown",
      "compensatingControl": "Supplier notices and model migration tests are reviewed before release.",
      "consequence": "Dataset-level upstream impact cannot be determined from this record.",
      "field": "trainingDataset",
      "id": "urn:example:unknown:model-training-data",
      "owner": "Example platform team",
      "reason": "The hosted model supplier does not publish a complete training dataset inventory.",
      "reviewAfter": "2026-12-01T00:00:00Z",
      "sensitivity": "public",
      "subject": "urn:example:model:openai:gpt-4.1"
    }
  ]
}
